{
  "body_file": "specs/xplat-010-repository-bash-confinement/.process/pr-packets/02-us14/body.md",
  "editable_fields": [
    {
      "end_marker": "<!-- speckit-pro-editable:summary:end -->",
      "field_id": "summary",
      "heading": "Summary",
      "start_marker": "<!-- speckit-pro-editable:summary:start -->"
    },
    {
      "end_marker": "<!-- speckit-pro-editable:what_changed:end -->",
      "field_id": "what_changed",
      "heading": "What Changed",
      "start_marker": "<!-- speckit-pro-editable:what_changed:start -->"
    },
    {
      "end_marker": "<!-- speckit-pro-editable:why_it_matters:end -->",
      "field_id": "why_it_matters",
      "heading": "Why It Matters",
      "start_marker": "<!-- speckit-pro-editable:why_it_matters:start -->"
    }
  ],
  "generated_title": {
    "description": "restore spec-size estimation",
    "rejected_candidates": [
      {
        "reason": "A branch name is not reviewer-facing Conventional Commit prose.",
        "value": "xplat-010-review/02-us14"
      }
    ],
    "scope": "xplat-010",
    "source_evidence": {
      "kind": "split_source_boundary",
      "result": "observed",
      "source": "docs/ai/specs/.process/autopilot-state.json",
      "summary": "The canonical marker supplies the exact adjacent stack target."
    },
    "type": "fix",
    "value": "fix(xplat-010): restore spec-size estimation"
  },
  "mode": "split",
  "packet_id": "02-us14",
  "protected_body_fingerprint": {
    "algorithm": "sha256",
    "elided_fields": [
      "summary",
      "what_changed",
      "why_it_matters"
    ],
    "normalization": "LF line endings; trailing spaces, tabs, and CR trimmed per line; slice from ## Summary through the first nonblank Known Gaps body paragraph; final newline ensured; editable block bodies replaced by <elided:field_id> before sha256; packet-source comment and Release note excluded.",
    "value": "c9c6cd259c577826fe0ec298aff5fc98b3db2ecc7eade314ae635afde971c92f"
  },
  "required_headings": [
    "Summary",
    "What Changed",
    "Why It Matters",
    "How To Review",
    "How To UAT",
    "Verification",
    "Scope",
    "Known Gaps"
  ],
  "schema_version": "1.0.0",
  "scope_evidence": {
    "budget_result": "within_budget",
    "changed_files": [
      "dist/claude/speckit-pro/speckit_pro_runner/helpers/read_only.py",
      "dist/claude/speckit-pro/speckit_pro_runner/helpers/registry.py",
      "dist/claude/speckit-pro/speckit_pro_runner/speckit-pro-runner.manifest.json",
      "dist/claude/speckit-pro/speckit_pro_runner/speckit-pro-runner.sha256",
      "dist/codex/speckit-pro/speckit_pro_runner/helpers/read_only.py",
      "dist/codex/speckit-pro/speckit_pro_runner/helpers/registry.py",
      "dist/codex/speckit-pro/speckit_pro_runner/speckit-pro-runner.manifest.json",
      "dist/codex/speckit-pro/speckit_pro_runner/speckit-pro-runner.sha256",
      "docs-site/src/content/docs/reference/tests.md",
      "docs/ai/specs/.process/XPLAT-009-installed-cache-proof.json",
      "docs/ai/specs/.process/XPLAT-009-payload-completeness-result.json",
      "docs/ai/specs/.process/XPLAT-009-release-readiness-result.json",
      "docs/ai/specs/.process/XPLAT-010-count-ledger.md",
      "release-please-config.json",
      "scripts/refresh-release-artifacts.py",
      "speckit-pro/speckit_pro_runner/helpers/read_only.py",
      "speckit-pro/speckit_pro_runner/helpers/registry.py",
      "speckit-pro/speckit_pro_runner/speckit-pro-runner.manifest.json",
      "speckit-pro/speckit_pro_runner/speckit-pro-runner.sha256",
      "tests/speckit-pro/layer4-scripts/fixtures/read-only-helpers/bash-reference-manifest.json",
      "tests/speckit-pro/layer4-scripts/fixtures/read-only-helpers/fixture-manifest.json",
      "tests/speckit-pro/layer4-scripts/fixtures/read-only-helpers/requests/estimate-spec-size.json",
      "tests/speckit-pro/layer4-scripts/fixtures/xplat-009-zero-bash/installed-cache-proof-file-root.json",
      "tests/speckit-pro/layer4-scripts/fixtures/xplat-009-zero-bash/installed-cache-proof-missing-mutable.json",
      "tests/speckit-pro/layer4-scripts/fixtures/xplat-009-zero-bash/installed-cache-proof-missing-source-root.json",
      "tests/speckit-pro/layer4-scripts/fixtures/xplat-009-zero-bash/installed-cache-proof-mutable.json",
      "tests/speckit-pro/layer4-scripts/fixtures/xplat-009-zero-bash/installed-cache-proof-partial-root.json",
      "tests/speckit-pro/layer4-scripts/fixtures/xplat-009-zero-bash/installed-cache-proof-root-mismatch.json",
      "tests/speckit-pro/layer4-scripts/fixtures/xplat-009-zero-bash/installed-cache-proof-same-root.json",
      "tests/speckit-pro/layer4-scripts/fixtures/xplat-009-zero-bash/installed-cache-proof-single-product.json",
      "tests/speckit-pro/layer4-scripts/fixtures/xplat-009-zero-bash/installed-cache-proof-source-mismatch.json",
      "tests/speckit-pro/layer4-scripts/fixtures/xplat-009-zero-bash/installed-cache-proof-stale-hash.json",
      "tests/speckit-pro/layer4-scripts/fixtures/xplat-009-zero-bash/installed-cache-proof-traversal-root.json",
      "tests/speckit-pro/layer4-scripts/fixtures/xplat-009-zero-bash/installed-cache-proof.json",
      "tests/speckit-pro/layer4-scripts/fixtures/xplat-009-zero-bash/installed-cache/claude/speckit-pro/speckit_pro_runner/helpers/read_only.py",
      "tests/speckit-pro/layer4-scripts/fixtures/xplat-009-zero-bash/installed-cache/claude/speckit-pro/speckit_pro_runner/helpers/registry.py",
      "tests/speckit-pro/layer4-scripts/fixtures/xplat-009-zero-bash/installed-cache/claude/speckit-pro/speckit_pro_runner/speckit-pro-runner.manifest.json",
      "tests/speckit-pro/layer4-scripts/fixtures/xplat-009-zero-bash/installed-cache/claude/speckit-pro/speckit_pro_runner/speckit-pro-runner.sha256",
      "tests/speckit-pro/layer4-scripts/fixtures/xplat-009-zero-bash/installed-cache/codex/speckit-pro/speckit_pro_runner/helpers/read_only.py",
      "tests/speckit-pro/layer4-scripts/fixtures/xplat-009-zero-bash/installed-cache/codex/speckit-pro/speckit_pro_runner/helpers/registry.py",
      "tests/speckit-pro/layer4-scripts/fixtures/xplat-009-zero-bash/installed-cache/codex/speckit-pro/speckit_pro_runner/speckit-pro-runner.manifest.json",
      "tests/speckit-pro/layer4-scripts/fixtures/xplat-009-zero-bash/installed-cache/codex/speckit-pro/speckit_pro_runner/speckit-pro-runner.sha256",
      "tests/speckit-pro/layer4-scripts/test-estimate-spec-size.py",
      "tests/speckit-pro/layer4-scripts/test-estimate-spec-size.sh",
      "tests/speckit-pro/layer4-scripts/test-release-pr-reconciliation.py",
      "tests/speckit-pro/layer4-scripts/test-speckit-pro-read-only-helpers.py",
      "tests/speckit-pro/layer4-scripts/test-speckit-pro-runner.py",
      "tests/speckit-pro/parity/xplat-010/test-estimate-spec-size-baseline.txt",
      "tests/speckit-pro/run-all.sh"
    ],
    "non_goals": [
      "No later stack slice is included in this adjacent branch diff.",
      "No hosted-check, merge, or release-publication result is claimed."
    ],
    "production_files": 6,
    "reviewable_loc": 135,
    "total_files": 49
  },
  "source_feature_dir": "specs/xplat-010-repository-bash-confinement",
  "source_markers": [
    {
      "marker_id": "task-boundary",
      "rendered_text": "Source: canonical marker `us16` maps this packet to T121-T130.",
      "source": "specs/xplat-010-repository-bash-confinement/tasks.md"
    },
    {
      "marker_id": "adjacent-diff",
      "rendered_text": "Source: adjacent diff `xplat-010-review/01-foundation (1304d5a1fdbee4329d16385369a535bc2fc7a448)..xplat-010-review/02-us14 (c2d3b0c7bde975c1d7f864ce43256c60e00e44d2)` contains 49 files, 914 insertions, 302 deletions, and 135 reviewable LOC.",
      "source": "git diff 1304d5a1fdbee4329d16385369a535bc2fc7a448..c2d3b0c7bde975c1d7f864ce43256c60e00e44d2"
    },
    {
      "marker_id": "uat-runbook",
      "rendered_text": "Source: `specs/xplat-010-repository-bash-confinement/.process/uat-runbook.md` is the acceptance procedure. This packet does not promote local evidence to hosted, merged, or published evidence.",
      "source": "specs/xplat-010-repository-bash-confinement/.process/uat-runbook.md"
    }
  ],
  "split_slice": {
    "slice_id": "02-us14",
    "source_boundary": {
      "section": "## Phase 17: User Story 16 - PR 13 - Spec-size estimator restored + manifest-version fix (independent, land early)"
    },
    "source_packet": "docs/ai/specs/.process/autopilot-state.json"
  },
  "target": {
    "base_branch": "xplat-010-review/01-foundation",
    "head_branch": "xplat-010-review/02-us14"
  },
  "uat": {
    "how_to_uat": "Use the committed feature UAT runbook on this exact candidate branch and record command, exit-code, and observable-result evidence.",
    "uat_runbook_heading": "## UAT Runbook",
    "uat_source": "specs/xplat-010-repository-bash-confinement/.process/uat-runbook.md"
  },
  "validation_result_path": "specs/xplat-010-repository-bash-confinement/.process/pr-packets/02-us14/validation.json",
  "verification_evidence": [
    {
      "kind": "immediate_branch_diff",
      "result": "passed",
      "source": "git diff 1304d5a1fdbee4329d16385369a535bc2fc7a448..c2d3b0c7bde975c1d7f864ce43256c60e00e44d2",
      "summary": "Observed 49 paths, 914 insertions, and 302 deletions."
    },
    {
      "kind": "task_traceability",
      "result": "passed",
      "source": "specs/xplat-010-repository-bash-confinement/tasks.md",
      "summary": "Marker us16 maps this packet to T121-T130."
    },
    {
      "kind": "stack_shape",
      "result": "passed",
      "source": "git rev-list 1304d5a1fdbee4329d16385369a535bc2fc7a448..c2d3b0c7bde975c1d7f864ce43256c60e00e44d2",
      "summary": "Observed 7 commits and 0 merge commits."
    }
  ]
}
