{
  "body_file": "specs/xplat-010-repository-bash-confinement/.process/pr-packets/15-release-contract/body.md",
  "editable_fields": [
    {
      "end_marker": "<!-- speckit-pro-editable:summary:end -->",
      "field_id": "summary",
      "heading": "Summary",
      "start_marker": "<!-- speckit-pro-editable:summary:start -->"
    },
    {
      "end_marker": "<!-- speckit-pro-editable:what_changed:end -->",
      "field_id": "what_changed",
      "heading": "What Changed",
      "start_marker": "<!-- speckit-pro-editable:what_changed:start -->"
    },
    {
      "end_marker": "<!-- speckit-pro-editable:why_it_matters:end -->",
      "field_id": "why_it_matters",
      "heading": "Why It Matters",
      "start_marker": "<!-- speckit-pro-editable:why_it_matters:start -->"
    }
  ],
  "generated_title": {
    "description": "validate consumer release-note blocks",
    "rejected_candidates": [
      {
        "reason": "A branch name is not reviewer-facing Conventional Commit prose.",
        "value": "xplat-010-review/15-release-contract"
      }
    ],
    "scope": "xplat-010",
    "source_evidence": {
      "kind": "split_source_boundary",
      "result": "observed",
      "source": "docs/ai/specs/.process/autopilot-state.json",
      "summary": "The canonical marker supplies the exact adjacent stack target."
    },
    "type": "feat",
    "value": "feat(xplat-010): validate consumer release-note blocks"
  },
  "mode": "split",
  "packet_id": "15-release-contract",
  "protected_body_fingerprint": {
    "algorithm": "sha256",
    "elided_fields": [
      "summary",
      "what_changed",
      "why_it_matters"
    ],
    "normalization": "LF line endings; trailing spaces, tabs, and CR trimmed per line; slice from ## Summary through the first nonblank Known Gaps body paragraph; final newline ensured; editable block bodies replaced by <elided:field_id> before sha256; packet-source comment and Release note excluded.",
    "value": "798319611c6fed4835ba5c860fe556de7d5e6828eba9a329f61c9bea33df197f"
  },
  "required_headings": [
    "Summary",
    "What Changed",
    "Why It Matters",
    "How To Review",
    "How To UAT",
    "Verification",
    "Scope",
    "Known Gaps"
  ],
  "schema_version": "1.0.0",
  "scope_evidence": {
    "budget_result": "warning",
    "changed_files": [
      "dist/claude/speckit-pro/skills/speckit-autopilot/contracts/release-note-block.contract.md",
      "dist/codex/speckit-pro/skills/speckit-autopilot/contracts/release-note-block.contract.md",
      "docs-site/src/content/docs/reference/scripts.md",
      "docs-site/src/content/docs/reference/tests.md",
      "docs/ai/specs/.process/XPLAT-009-installed-cache-proof.json",
      "docs/ai/specs/.process/XPLAT-009-payload-completeness-result.json",
      "docs/ai/specs/.process/XPLAT-009-release-readiness-result.json",
      "docs/ai/specs/.process/XPLAT-010-count-ledger.md",
      "scripts/release_note_policy.py",
      "speckit-pro/skills/speckit-autopilot/contracts/release-note-block.contract.md",
      "tests/speckit-pro/parity/bash-to-python/test-release-note-policy-baseline.txt",
      "tests/speckit-pro/suite-manifest.json",
      "tests/speckit-pro/unit/fixtures/plugin-bash-confinement/installed-cache-proof-file-root.json",
      "tests/speckit-pro/unit/fixtures/plugin-bash-confinement/installed-cache-proof-missing-mutable.json",
      "tests/speckit-pro/unit/fixtures/plugin-bash-confinement/installed-cache-proof-missing-source-root.json",
      "tests/speckit-pro/unit/fixtures/plugin-bash-confinement/installed-cache-proof-mutable.json",
      "tests/speckit-pro/unit/fixtures/plugin-bash-confinement/installed-cache-proof-root-mismatch.json",
      "tests/speckit-pro/unit/fixtures/plugin-bash-confinement/installed-cache-proof-same-root.json",
      "tests/speckit-pro/unit/fixtures/plugin-bash-confinement/installed-cache-proof-single-product.json",
      "tests/speckit-pro/unit/fixtures/plugin-bash-confinement/installed-cache-proof-source-mismatch.json",
      "tests/speckit-pro/unit/fixtures/plugin-bash-confinement/installed-cache-proof-stale-hash.json",
      "tests/speckit-pro/unit/fixtures/plugin-bash-confinement/installed-cache-proof-traversal-root.json",
      "tests/speckit-pro/unit/fixtures/plugin-bash-confinement/installed-cache-proof.json",
      "tests/speckit-pro/unit/fixtures/plugin-bash-confinement/installed-cache/claude/speckit-pro/skills/speckit-autopilot/contracts/release-note-block.contract.md",
      "tests/speckit-pro/unit/fixtures/plugin-bash-confinement/installed-cache/codex/speckit-pro/skills/speckit-autopilot/contracts/release-note-block.contract.md",
      "tests/speckit-pro/unit/test-release-note-policy.py"
    ],
    "non_goals": [
      "No later stack slice is included in this adjacent branch diff.",
      "No hosted-check, merge, or release-publication result is claimed."
    ],
    "production_files": 1,
    "reviewable_loc": 546,
    "total_files": 26
  },
  "source_feature_dir": "specs/xplat-010-repository-bash-confinement",
  "source_markers": [
    {
      "marker_id": "task-boundary",
      "rendered_text": "Source: canonical marker `us14` maps this packet to T109-T112.",
      "source": "specs/xplat-010-repository-bash-confinement/tasks.md"
    },
    {
      "marker_id": "adjacent-diff",
      "rendered_text": "Source: adjacent diff `xplat-010-review/14-us11 (c6b47a6d8587f4a1b841f3d52bc8ba933794ac98)..xplat-010-review/15-release-contract (b3c81e25fae0e00b52a4cc95c681322630af592f)` contains 26 files, 1831 insertions, 31 deletions, and 546 reviewable LOC.",
      "source": "git diff c6b47a6d8587f4a1b841f3d52bc8ba933794ac98..b3c81e25fae0e00b52a4cc95c681322630af592f"
    },
    {
      "marker_id": "uat-runbook",
      "rendered_text": "Source: `specs/xplat-010-repository-bash-confinement/.process/uat-runbook.md` is the acceptance procedure. This packet does not promote local evidence to hosted, merged, or published evidence.",
      "source": "specs/xplat-010-repository-bash-confinement/.process/uat-runbook.md"
    }
  ],
  "split_slice": {
    "slice_id": "15-release-contract",
    "source_boundary": {
      "section": "## Phase 15: User Story 14 - PR 12a - Release-note extraction, sanitization, validation module + focused tests (independent)"
    },
    "source_packet": "docs/ai/specs/.process/autopilot-state.json"
  },
  "target": {
    "base_branch": "xplat-010-review/14-us11",
    "head_branch": "xplat-010-review/15-release-contract"
  },
  "uat": {
    "how_to_uat": "Use the committed feature UAT runbook on this exact candidate branch and record command, exit-code, and observable-result evidence.",
    "uat_runbook_heading": "## UAT Runbook",
    "uat_source": "specs/xplat-010-repository-bash-confinement/.process/uat-runbook.md"
  },
  "validation_result_path": "specs/xplat-010-repository-bash-confinement/.process/pr-packets/15-release-contract/validation.json",
  "verification_evidence": [
    {
      "kind": "immediate_branch_diff",
      "result": "passed",
      "source": "git diff c6b47a6d8587f4a1b841f3d52bc8ba933794ac98..b3c81e25fae0e00b52a4cc95c681322630af592f",
      "summary": "Observed 26 paths, 1831 insertions, and 31 deletions."
    },
    {
      "kind": "task_traceability",
      "result": "passed",
      "source": "specs/xplat-010-repository-bash-confinement/tasks.md",
      "summary": "Marker us14 maps this packet to T109-T112."
    },
    {
      "kind": "stack_shape",
      "result": "passed",
      "source": "git rev-list c6b47a6d8587f4a1b841f3d52bc8ba933794ac98..b3c81e25fae0e00b52a4cc95c681322630af592f",
      "summary": "Observed 5 commits and 0 merge commits."
    }
  ]
}
