{
  "schema_version": "1.0.0",
  "packet_id": "pr-packet",
  "mode": "single",
  "target": {
    "base_branch": "main",
    "head_branch": "doc-006-safe-interactive-selector-and-validation-aids"
  },
  "source_feature_dir": "specs/doc-006-safe-interactive-selector-and-validation-aids",
  "generated_title": {
    "value": "docs(DOC-006): Add safe interactive selector and validation aids",
    "type": "docs",
    "scope": "DOC-006",
    "description": "Add safe interactive selector and validation aids",
    "source_evidence": {
      "kind": "feature_spec",
      "source": "specs/doc-006-safe-interactive-selector-and-validation-aids/spec.md",
      "summary": "Feature title normalized into a public action phrase."
    },
    "rejected_candidates": [
      {
        "value": "Safe Interactive Selector and Validation Aids",
        "reason": "Feature display title is source evidence, not the final conventional title."
      },
      {
        "value": "doc-006-safe-interactive-selector-and-validation-aids",
        "reason": "Branch names remain metadata and are not title descriptions."
      }
    ]
  },
  "body_file": "specs/doc-006-safe-interactive-selector-and-validation-aids/.process/pr-body.md",
  "required_headings": [
    "Summary",
    "What Changed",
    "Why It Matters",
    "How To Review",
    "How To UAT",
    "Verification",
    "Scope",
    "Known Gaps"
  ],
  "verification_evidence": [
    {
      "kind": "layer4_script",
      "source": "tests/speckit-pro/layer4-scripts/test-generate-pr-body.sh",
      "summary": "Focused validator covers source-derived selector data and built page output.",
      "result": "passed"
    },
    {
      "kind": "docs_site",
      "source": "docs-site",
      "summary": "Docs validation and link validation completed successfully.",
      "result": "passed"
    },
    {
      "kind": "spec_suite",
      "source": "tests/speckit-pro/run-all.sh",
      "summary": "Full deterministic suite completed successfully.",
      "result": "passed"
    }
  ],
  "scope_evidence": {
    "reviewable_loc": 846,
    "production_files": 2,
    "total_files": 25,
    "budget_result": "within_budget",
    "changed_files": [
      "docs-site/scripts/validate-doc006-safe-aids.mjs",
      "docs-site/src/components/SafeInstallAids.astro",
      "docs-site/src/content/docs/choose-your-path.mdx",
      "docs-site/src/data/safe-install-aids.ts",
      "docs/ai/specs/.process/DOC-006-design-concept.md",
      "docs/ai/specs/.process/DOC-006-workflow.md",
      "docs/ai/specs/.process/autopilot-state.json",
      "docs/ai/specs/interactive-documentation-roadmap-MOC.md",
      "docs/ai/specs/interactive-documentation-technical-roadmap.md",
      "specs/doc-006-safe-interactive-selector-and-validation-aids/.process/marker-plan/pr-marker-plan.json",
      "specs/doc-006-safe-interactive-selector-and-validation-aids/.process/reviewability/atomicity-route.json",
      "specs/doc-006-safe-interactive-selector-and-validation-aids/.process/reviewability/tasks-gate-result.json",
      "specs/doc-006-safe-interactive-selector-and-validation-aids/SPEC-MOC.md",
      "specs/doc-006-safe-interactive-selector-and-validation-aids/checklists/accessibility.md",
      "specs/doc-006-safe-interactive-selector-and-validation-aids/checklists/error-handling.md",
      "specs/doc-006-safe-interactive-selector-and-validation-aids/checklists/integration.md",
      "specs/doc-006-safe-interactive-selector-and-validation-aids/checklists/requirements.md",
      "specs/doc-006-safe-interactive-selector-and-validation-aids/checklists/ux.md",
      "specs/doc-006-safe-interactive-selector-and-validation-aids/contracts/doc006-safe-aids.schema.json",
      "specs/doc-006-safe-interactive-selector-and-validation-aids/data-model.md",
      "specs/doc-006-safe-interactive-selector-and-validation-aids/plan.md",
      "specs/doc-006-safe-interactive-selector-and-validation-aids/quickstart.md",
      "specs/doc-006-safe-interactive-selector-and-validation-aids/research.md",
      "specs/doc-006-safe-interactive-selector-and-validation-aids/spec.md",
      "specs/doc-006-safe-interactive-selector-and-validation-aids/tasks.md"
    ],
    "non_goals": [
      "Live doctor command and browser-side shell execution are out of scope.",
      "User-local JSON checking and config mutation are out of scope.",
      "Full troubleshooting, trust, update, rollback, cache diagnosis, search, deep links, and broader hardening are deferred."
    ]
  },
  "uat": {
    "how_to_uat": "Run focused docs validation, docs-site validation, link validation, and the full deterministic suite; inspect the built install-path page.",
    "uat_runbook_heading": "## UAT Runbook",
    "uat_source": "specs/doc-006-safe-interactive-selector-and-validation-aids/.process/pr-body.md"
  },
  "source_markers": [
    {
      "marker_id": "feature-spec",
      "rendered_text": "Source: feature specification defines safe selector, checker, diagram, and checklist behavior.",
      "source": "specs/doc-006-safe-interactive-selector-and-validation-aids/spec.md"
    },
    {
      "marker_id": "schema-contract",
      "rendered_text": "Source: implementation artifacts define the reviewed behavior.",
      "source": "specs/doc-006-safe-interactive-selector-and-validation-aids/tasks.md"
    },
    {
      "marker_id": "quickstart-verification",
      "rendered_text": "Source: verification report records completed validation evidence.",
      "source": "specs/doc-006-safe-interactive-selector-and-validation-aids/.process/verify-report.md"
    }
  ],
  "editable_fields": [
    {
      "field_id": "summary",
      "heading": "Summary",
      "start_marker": "<!-- speckit-pro-editable:summary:start -->",
      "end_marker": "<!-- speckit-pro-editable:summary:end -->"
    },
    {
      "field_id": "what_changed",
      "heading": "What Changed",
      "start_marker": "<!-- speckit-pro-editable:what_changed:start -->",
      "end_marker": "<!-- speckit-pro-editable:what_changed:end -->"
    },
    {
      "field_id": "why_it_matters",
      "heading": "Why It Matters",
      "start_marker": "<!-- speckit-pro-editable:why_it_matters:start -->",
      "end_marker": "<!-- speckit-pro-editable:why_it_matters:end -->"
    }
  ],
  "protected_body_fingerprint": {
    "algorithm": "sha256",
    "value": "65d6348f355a29cc1eba1be6483cd0dbdda48233fcb551c4ef829a7ddc8cf0e6",
    "normalization": "canonical packet block only; LF line endings; trailing whitespace trimmed; final newline ensured; editable block bodies replaced by <elided:field_id> before sha256.",
    "elided_fields": [
      "summary",
      "what_changed",
      "why_it_matters"
    ]
  },
  "validation_result_path": "specs/doc-006-safe-interactive-selector-and-validation-aids/.process/pr-packets/pr-packet/validation.json"
}
